{
    "v": 1,
    "batch": "6c1f0c2e-8f4a-4b7e-9a3d-5e2b1c0d9f8a",
    "mode": "full",
    "sentAt": 1727430060000,
    "context": {
        "sdk": "mirafive-browser/1.0.0 react",
        "locale": "de-DE",
        "timezone": "Europe/Berlin",
        "screen": [1512, 982]
    },
    "events": [
        {
            "name": "$pageview",
            "time": 1727430000000,
            "page": {
                "url": "https://shop.example/checkout",
                "title": "Kasse",
                "referrer": "https://shop.example/pricing"
            },
            "properties": { "$boot": 1 },
            "anonymousId": "5f0c1c8e-3e0e-4a57-9d59-3f7f2a6d1e44",
            "sessionId": "b2c3d4e5-f6a7-4b8c-9d0e-1f2a3b4c5d6e"
        },
        {
            "name": "$autocapture",
            "time": 1727430012000,
            "page": { "url": "https://shop.example/checkout" },
            "properties": {
                "$event_type": "click",
                "$el_tag": "button",
                "$el_selector": "form > button.primary",
                "$el_text": "Jetzt kaufen"
            },
            "anonymousId": "5f0c1c8e-3e0e-4a57-9d59-3f7f2a6d1e44",
            "sessionId": "b2c3d4e5-f6a7-4b8c-9d0e-1f2a3b4c5d6e"
        },
        {
            "name": "$identify",
            "time": 1727430030000,
            "properties": { "plan": "pro" },
            "anonymousId": "5f0c1c8e-3e0e-4a57-9d59-3f7f2a6d1e44",
            "userId": "u_42",
            "sessionId": "b2c3d4e5-f6a7-4b8c-9d0e-1f2a3b4c5d6e"
        },
        {
            "name": "order completed",
            "time": 1727430055000,
            "page": { "url": "https://shop.example/thanks" },
            "properties": {
                "revenue": 49.9,
                "currency": "EUR",
                "items": [{ "sku": "tee-black", "quantity": 2 }]
            },
            "anonymousId": "5f0c1c8e-3e0e-4a57-9d59-3f7f2a6d1e44",
            "userId": "u_42",
            "sessionId": "b2c3d4e5-f6a7-4b8c-9d0e-1f2a3b4c5d6e"
        }
    ]
}
