{
    "v": 1,
    "batch": "b9c1d2e3-f4a5-4b6c-8d7e-9f0a1b2c3d4e",
    "mode": "consentless",
    "context": {
        "sdk": "mirafive-server/1.0.0"
    },
    "events": [
        {
            "name": "invoice paid",
            "time": 1727430300000,
            "properties": { "revenue": 99, "currency": "EUR" }
        }
    ]
}
