{
    "v": 1,
    "batch": "274e05f0-4dd7-8db9-a563-87ea5c891487",
    "mode": "full",
    "sentAt": 1727430200000,
    "context": {
        "sdk": "mirafive-php/0.5.0"
    },
    "events": [
        {
            "name": "order completed",
            "id": "8a1b2c3d-4e5f-4a6b-8c7d-9e0f1a2b3c4d",
            "time": 1727430199000,
            "userId": "u_42",
            "properties": { "order": "981", "revenue": 129, "currency": "EUR" }
        }
    ]
}
