{
    "v": 1,
    "batch": "0192d4a8-7b1c-4e8a-9c1d-2b3e4f5a6b7c",
    "mode": "consentless",
    "sentAt": 1727430000000,
    "context": {
        "sdk": "mirafive-tracker/0.5.0"
    },
    "events": [
        {
            "name": "$pageview",
            "time": 1727429999990,
            "page": {
                "url": "https://shop.example/pricing?utm_source=news",
                "title": "Pricing",
                "referrer": "https://www.google.com/"
            }
        }
    ]
}
